"new.article.id","year","journal","pmid","author","title","abstract","url"
"X5430","%D 2019","%B J Affect Disord","%M 30986738","%A Roberge, E. M.","%T Variables associated with reductions in insomnia severity among acutely suicidal patients receiving brief cognitive behavioral therapy for suicide prevention","%X This study compared changes in sleep disturbance over time across brief cognitive behavioral therapy for suicide prevention and treatment as usual and examined the mechanisms that link sleep disturbance with several suicide risk factors.|Active duty U.S. Army soldiers (N‰Ûø=‰Ûø152) completed a randomized controlled trial to test the efficacy of brief cognitive behavioral therapy (n‰Ûø=‰Ûø76) or treatment as usual (n‰Ûø=‰Ûø76). Six assessments of insomnia symptoms, hopelessness, coping, and suicide beliefs were tracked over 24 months.|Brief cognitive behavioral therapy patients reported a significant decrease in sleep disturbance symptoms over time while treatment as usual patients did not. These improvements were initially observed during treatment and carried over through 12-months. Changes in sleep disturbance predicted changes in suicide risk. Longitudinal growth modeling was used to assess potential mechanisms of this effect. Results suggested that changes in cognitive flexibility, as defined by measures of hopelessness and suicide beliefs, predicted change in sleep disturbance symptoms. These relationships did not differ across treatment groups.|The participants were active duty military personnel. Therefore, the results may not generalize to other patient populations. A greater number of assessment periods in closer proximity as well as additional measures of constructs of interest would have improved the internal validity of this study.|Brief cognitive behavioral therapy significantly reduces sleep disturbance and suicide risk. Changes in cognitive flexibility, in part, explain change in sleep disturbance across both treatments.","%U https://www.ncbi.nlm.nih.gov/pubmed/30986738"
"X5532","%D 2017","%B Psychol Med","%M 28374665","%A Rosellini, A. J.","%T Using self-report surveys at the beginning of service to develop multi-outcome risk models for new soldiers in the U.S. Army","%X The U.S. Army uses universal preventives interventions for several negative outcomes (e.g. suicide, violence, sexual assault) with especially high risks in the early years of service. More intensive interventions exist, but would be cost-effective only if targeted at high-risk soldiers. We report results of efforts to develop models for such targeting from self-report surveys administered at the beginning of Army service.|21 832 new soldiers completed a self-administered questionnaire (SAQ) in 2011-2012 and consented to link administrative data to SAQ responses. Penalized regression models were developed for 12 administratively-recorded outcomes occurring by December 2013: suicide attempt, mental hospitalization, positive drug test, traumatic brain injury (TBI), other severe injury, several types of violence perpetration and victimization, demotion, and attrition.|The best-performing models were for TBI (AUC = 0.80), major physical violence perpetration (AUC = 0.78), sexual assault perpetration (AUC = 0.78), and suicide attempt (AUC = 0.74). Although predicted risk scores were significantly correlated across outcomes, prediction was not improved by including risk scores for other outcomes in models. Of particular note: 40.5% of suicide attempts occurred among the 10% of new soldiers with highest predicted risk, 57.2% of male sexual assault perpetrations among the 15% with highest predicted risk, and 35.5% of female sexual assault victimizations among the 10% with highest predicted risk.|Data collected at the beginning of service in self-report surveys could be used to develop risk models that define small proportions of new soldiers accounting for high proportions of negative outcomes over the first few years of service.","%U https://www.ncbi.nlm.nih.gov/pubmed/28374665"
"X5680","%D 2017","%B Am J Public Health","%M 28323466","%A Rosellini, A. J.","%T Sexual Assault Victimization and Mental Health Treatment, Suicide Attempts, and Career Outcomes Among Women in the US Army","%X To examine associations of administratively recorded sexual assault victimization during military service with subsequent mental health and negative career outcomes among US Army women controlling for nonrandom victimization exposure.|We used data from the Army Study to Assess Risk and Resilience in Servicemembers to apply propensity score methods to match all 4238 female Regular Army soldiers with administratively recorded sexual assault victimization during 2004 to 2009 to 5 controls per case with similar composite victimization risk. We examined associations of this victimization measure with administratively recorded mental health treatment, suicide attempt, and Army career outcomes over the subsequent 12 months by using survival analysis for dichotomous outcomes and conditional generalized linear models for continuous outcomes.|Women with administratively recorded sexual assault had significantly elevated odds ratios (ORs) of subsequent mental health treatment (any, OR‰Ûä=‰Ûä2.5; 95% confidence interval [CI]‰Ûä=‰Ûä2.4, 2.6; specialty, OR‰Ûä=‰Ûä3.1; 95% CI‰Ûä=‰Ûä2.9, 3.3; inpatient, OR‰Ûä=‰Ûä2.8; 95% CI‰Ûä=‰Ûä2.5, 3.1), posttraumatic stress disorder treatment (any, OR‰Ûä=‰Ûä6.3; 95% CI‰Ûä=‰Ûä5.7, 6.9; specialty, OR‰Ûä=‰Ûä7.7; 95% CI‰Ûä=‰Ûä6.8, 8.6; inpatient, OR‰Ûä=‰Ûä6.8; 95% CI‰Ûä=‰Ûä5.4, 8.6), suicide attempt (OR‰Ûä=‰Ûä3.0; 95% CI‰Ûä=‰Ûä2.5, 3.6), demotion (OR‰Ûä=‰Ûä2.1; 95% CI‰Ûä=‰Ûä1.9, 2.3), and attrition (OR‰Ûä=‰Ûä1.2; 95% CI‰Ûä=‰Ûä1.1, 1.2).|Sexual assault victimization is associated with considerable suffering and likely decreased force readiness.","%U https://www.ncbi.nlm.nih.gov/pubmed/28323466"
"X5738","%D 2019","%B Early Interv Psychiatry","%M 29943518","%A Rozek, D. C.","%T Short-term effects of crisis response planning on optimism in a U.S. Army sample","%X This study examined the short-term effects of a brief crisis intervention on optimism of acutely suicidal soldiers.|U.S. Soldiers (N‰Ûä=‰Ûä97) presenting for an emergency mental health appointment in a military emergency department or behavioural health clinic were randomly assigned to treatment as usual standard crisis response plan, or enhanced crisis response plan (E-CRP). This study is used a subsample of the original clinical trial (n‰Ûä=‰Ûä64) for those who completed self-report measures of optimism (Life Orientation Test-Revised) prior to receiving any intervention and a secondary self-report assessment one-month following the intervention.|Results indicate that individuals with low baseline optimism who received the E-CRP had significant increases in optimism 1‰Ûämonth post-intervention.|This provides evidence that discussing a patient's reasons for living during a CRP increases optimism in those high-risk patients with the lowest baseline optimism.","%U https://www.ncbi.nlm.nih.gov/pubmed/29943518"
"X5787","%D 2021","%B Suicide Life Threat Behav","%M 34142741","%A Schaughency, K. C. L.","%T Financial costs to the U.S. Army for suicides by newly enlisted Soldiers","%X To estimate the financial burden to the U.S. Army of suicide by enlisted Soldiers during their first year of service.|This analysis included new Army enlisted Soldiers who started initial entry training from October 2012 through September 2016 and subsequently died by suicide within their first year of service. Outpatient and inpatient direct medical, direct nonmedical, recruiting, and training costs to the Army were calculated.|During the 48-month observational study period, 29 Soldiers died by suicide within their respective first year of service. The described financial costs accrued by the Army as a result of these deaths were $152,271-with an average of $6,091 per healthcare utilizer. Recruiting and training costs were $1,115,860 for all suicide cases.|Average direct cost per healthcare utilizer increased during a Soldier's first year of service. This may be associated with the transition through different phases of training and to the first operational duty station.|Results obtained through this cost-of-illness analysis may serve as baseline metrics to inform future cost-effectiveness studies.","%U https://www.ncbi.nlm.nih.gov/pubmed/34142741"
"X5832","%D 2017","%B J Clin Psychol","%M 27478932","%A Silva, C.","%T Evidence for the Propositions of the Interpersonal Theory of Suicide Among a Military Sample","%X Although the interpersonal theory of suicide may explain the elevated suicide risk among military service members, past explorations have been equivocal. This study aimed to investigate the propositions of the interpersonal theory in a sample of U.S. Army recruiters.|Participants (N = 3,428) completed self-report measures assessing the interpersonal theory's constructs (i.e., thwarted belongingness (TB), perceived burdensomeness (PB), acquired capability for suicide), current suicidal ideation, agitation, and insomnia. History of depression was obtained from medical records.|Hierarchical multiple regression analyses revealed that the interaction between TB and PB was associated with current suicidal ideation, controlling for depression, agitation, and insomnia. This effect was especially notable among those with high capability for suicide.|Findings provide support for the interpersonal theory in a large, diverse military sample. It may be advantageous to assess and therapeutically address TB and PB among at-risk service members.","%U https://www.ncbi.nlm.nih.gov/pubmed/27478932"
"X5884","%D 2008","%B J Chir (Paris)","%M 19106867","%A Sockeel, P.","%T [The Main Gate Syndrome: a new format in mass-casualty victim ""surge"" management?]","%X Recent suicide bombings pose the novel problem for Trauma Centers of the massive simultaneous arrival of many gravely wounded patients.|We report the experience of the French-German Military Trauma Group, a Level 2 Trauma Center, in Afghanistan during the wave of suicide bombings in February 2007.|Fourteen casualties were received. A first triage was carried out by the U S Army Level I group prior to evacuation. A second surgical triage was carried out with systematic ultrasound exam. Four cases (ISS>25) were re-categorized and underwent emergency surgical procedures.|Suicide bombing in crowded locations near an evacuation hospital may overwhelm the medical resources of the receiving center. It has been referred to as ""The Main Gate Syndrome."" We introduced the novel concept of a semi-evacuation hospital or receiving center where a second surgical triage was carried out. These exceptional circumstances require open-minded flexibility, a tailored approach, and close cooperation between surgeons and anesthetists to share experience, opinions, and ideas. In the setting of mass casualties, emergency ultrasound exam was shown to be a valuable and effective tool by virtue of its mobility, reproducibility, and immediate results.","%U https://www.ncbi.nlm.nih.gov/pubmed/19106867"
"X5932","%D 2021","%B Psychol Serv","%M 31916811","%A Stanley, I. H.","%T The intersection of PTSD symptoms and firearm storage practices within a suicide prevention framework: Findings from a U.S. Army National Guard sample","%X Soldiers in the U.S. Army National Guard are at elevated risk for suicide compared to soldiers in the other components. Most suicides by military service members, including members of the U.S. Army National Guard, are enacted with personal firearms. The unsafe storage of firearms is associated with increased risk for death by suicide. Therefore, efforts to elucidate modifiable factors associated with unsafe firearm storage have the potential to inform military suicide prevention efforts. PTSD hyperarousal symptoms are characterized in part by a heightened sense of being ""on guard"" for potential dangers and might contribute to an increased likelihood of storing firearms unsafely. This study sought to examine if more severe PTSD hyperarousal symptoms are associated with greater unsafe firearm storage practices. Participants were 327 U.S. Army National Guard personnel (%Z Stanley, Ian H","%U https://www.ncbi.nlm.nih.gov/pubmed/31916811"
"X5962","%D 2018","%B J Clin Psychiatry","%M 28541647","%A Stein, M. B.","%T Childhood Maltreatment and Lifetime Suicidal Behaviors Among New Soldiers in the US Army: Results From the Army Study to Assess Risk and Resilience in Servicemembers (Army STARRS)","%X Understanding suicide risk is a priority for the US military. We aimed to estimate associations of childhood maltreatment with pre-enlistment suicidal behaviors in new Army soldiers.|Cross-sectional survey data from 38,237 soldiers reporting for basic training from April 2011 through November 2012 were analyzed. Scales assessing retrospectively reported childhood abuse and neglect were derived and subjected to latent class analysis, which yielded 5 profiles: No Maltreatment, Episodic Emotional Maltreatment, Frequent Emotional/Physical Maltreatment, Episodic Emotional/Sexual Abuse, and Frequent Emotional/Physical/Sexual Maltreatment. Discrete-time survival analysis was used to estimate associations of maltreatment profiles with suicidal behaviors (assessed with a modified Columbia-Suicide Severity Rating Scale), adjusting for sociodemographics and mental disorders.|Nearly 1 in 5 new soldiers was classified as experiencing childhood maltreatment. Relative to No Maltreatment, all multivariate maltreatment profiles were associated (P values < .001) with elevated odds of lifetime suicidal ideation (adjusted odds ratios [AORs] = 3.10-4.93), plan (AORs = 3.75-10.77), attempt (AORs = 3.60-15.95), and onset of plan among those with ideation (AORs = 1.40-3.10). Several profiles also predicted attempts among those with plans (AORs = 2.01-2.47), and Frequent Emotional/Physical/Sexual Maltreatment predicted unplanned attempts among ideators (AOR = 5.32). Adjustment for mental disorders attenuated but did not eliminate these associations.|Childhood maltreatment is strongly associated with suicidal behavior among new soldiers, even after adjusting for intervening mental disorders. Among soldiers with lifetime ideation, certain maltreatment profiles are associated with elevated odds of subsequently planning and/or attempting suicide. Focus on childhood maltreatment might reveal avenues for risk reduction among new soldiers.","%U https://www.ncbi.nlm.nih.gov/pubmed/28541647"
"X6021","%D 2019","%B Psychiatry","%M 31566520","%A Stokes, C. M.","%T Risk Factors and Timing of Suicide Attempts among US Army Reserve Component Soldiers during Deployment to the Afghanistan and Iraq Wars: Results from Army Study to Assess Risk and Resilience in Servicemembers","%X: During the wars in Afghanistan and Iraq, suicidal behaviors increased among U.S. Army soldiers. Although Reserve Component (RC) soldiers (National Guard and Army Reserve) comprise approximately one third of those deployed in support of the wars, few studies have examined suicidal behaviors among these ""citizen-soldiers"". The objective of this study is to examine suicide attempt risk factors and timing among RC enlisted soldiers.","%U https://www.ncbi.nlm.nih.gov/pubmed/31566520"
"X6139","%D 2015","%B Psychol Med","%M 25359554","%A Street, A. E.","%T Understanding the elevated suicide risk of female soldiers during deployments","%X The Army Study to Assess Risk and Resilience in Servicemembers (Army STARRS) has found that the proportional elevation in the US Army enlisted soldier suicide rate during deployment (compared with the never-deployed or previously deployed) is significantly higher among women than men, raising the possibility of gender differences in the adverse psychological effects of deployment.|Person-month survival models based on a consolidated administrative database for active duty enlisted Regular Army soldiers in 2004-2009 (n = 975,057) were used to characterize the gender ÌÑ deployment interaction predicting suicide. Four explanatory hypotheses were explored involving the proportion of females in each soldier's occupation, the proportion of same-gender soldiers in each soldier's unit, whether the soldier reported sexual assault victimization in the previous 12 months, and the soldier's pre-deployment history of treated mental/behavioral disorders.|The suicide rate of currently deployed women (14.0/100,000 person-years) was 3.1-3.5 times the rates of other (i.e. never-deployed/previously deployed) women. The suicide rate of currently deployed men (22.6/100,000 person-years) was 0.9-1.2 times the rates of other men. The adjusted (for time trends, sociodemographics, and Army career variables) female:male odds ratio comparing the suicide rates of currently deployed v. other women v. men was 2.8 (95% confidence interval 1.1-6.8), became 2.4 after excluding soldiers with Direct Combat Arms occupations, and remained elevated (in the range 1.9-2.8) after adjusting for the hypothesized explanatory variables.|These results are valuable in excluding otherwise plausible hypotheses for the elevated suicide rate of deployed women and point to the importance of expanding future research on the psychological challenges of deployment for women.","%U https://www.ncbi.nlm.nih.gov/pubmed/25359554"
"X6279","%D 2022","%B Psychol Med","%M 35979895","%A Taylor, C. T.","%T Social network size and personality traits independently and prospectively predict distress disorders and suicidal behavior in U.S. Army soldiers","%X Personality traits (e.g. neuroticism) and the social environment predict risk for internalizing disorders and suicidal behavior. Studying these characteristics together and prospectively within a population confronted with high stressor exposure (e.g. U.S. Army soldiers) has not been done, yet could uncover unique and interactive predictive effects that may inform prevention and early intervention efforts.|Five broad personality traits and social network size were assessed via self-administered questionnaires among experienced soldiers preparing for deployment (|Among the personality traits, elevated neuroticism was consistently associated with increased mental health risk following deployment. Small social networks were also associated with increased mental health risk following deployment, beyond the variance accounted for by personality. Limited support was found for social network size moderating the association between personality and mental health outcomes. Small social networks also predicted distress disorders and suicidal behavior 5 years following enlistment, whereas unique effects of personality traits on these more distal outcomes were rare.|Heightened neuroticism and small social networks predict a greater risk for negative mental health sequelae, especially following deployment. Social ties may mitigate adverse impacts of personality traits on psychopathology in some contexts. Early identification and targeted intervention for these distinct, modifiable factors may decrease the risk of distress disorders and suicidal behavior.","%U https://www.ncbi.nlm.nih.gov/pubmed/35979895"
"X6318","%D 2019","%B Psychol Med","%M 30131080","%A Turner, B. J.","%T Non-suicidal self-injury prevalence, course, and association with suicidal thoughts and behaviors in two large, representative samples of US Army soldiers","%X Non-suicidal self-injury (NSSI) prospectively predicts suicidal thoughts and behaviors in civilian populations. Despite high rates of suicide among US military members, little is known about the prevalence and course of NSSI, or how NSSI relates to suicidal thoughts and behaviors, in military personnel.|We conducted secondary analyses of two representative surveys of active-duty soldiers (N = 21 449) and newly enlisted soldiers (N = 38 507) from the Army Study to Assess Risk and Resilience in Servicemembers (Army STARRS).|The lifetime prevalence of NSSI is 6.3% (1.2% 12-month prevalence) in active-duty soldiers and 7.9% (1.3% 12-month prevalence) in new soldiers. Demographic risk factors for lifetime NSSI include female sex, younger age, non-Hispanic white ethnicity, never having married, and lower educational attainment. The association of NSSI with temporally primary internalizing and externalizing disorders varies by service history (new v. active-duty soldiers) and gender (men v. women). In both active-duty and new soldiers, NSSI is associated with increased odds of subsequent onset of suicidal ideation [adjusted odds ratio (OR) = 1.66-1.81] and suicide attempts (adjusted OR = 2.02-2.43), although not with the transition from ideation to attempt (adjusted OR = 0.92-1.36). Soldiers with a history of NSSI are more likely to have made multiple suicide attempts, compared with soldiers without NSSI.|NSSI is prevalent among US Army soldiers and is associated with significantly increased odds of later suicidal thoughts and behaviors, even after NSSI has resolved. Suicide risk assessments in military populations should screen for history of NSSI.","%U https://www.ncbi.nlm.nih.gov/pubmed/30131080"
