"new.article.id","year","journal","pmid","author","title","abstract","url"
"X3958","%D 2018","%B Mil Med","%M 29590473","%A Maynard, C.","%T Disability Rating, Age at Death, and Cause of Death in U.S. Veterans with Service-Connected Conditions","%X The association between disability and cause of death in Veterans with service-connected disabilities has not been studied. The objective of this study was to compare age at death, military service and disability characteristics, including disability rating, and cause of death by year of birth. We also examined cause of death for specific service-connected conditions.|This study used information from the VETSNET file, which is a snapshot of selected items from the Veterans Benefits Administration corporate database. We also used the National Death Index (NDI) for Veterans which is part of the VA Suicide Data Repository. In VETSNET, there were 758,324 Veterans who had a service-connected condition and died between the years 2004 and 2014. Using the scrambled social security number to link the two files resulted in 605,493 (80%) deceased Veterans. Age at death, sex, and underlying cause of death were obtained from the NDI for Veterans and military service characteristics and types of disability were acquired from VETSNET. We constructed age categories corresponding to period of service; birth years 1938 and earlier corresponded to Korea and World War II (""oldest""), birth years 1939-1957 to the Vietnam era (""middle""), and birth years 1958 and later to post Vietnam, Gulf War, and the more recent conflicts in Iraq and Afghanistan (""youngest"").|Sixty-two percent were in the oldest age category, 34% in the middle group, and 4% in the youngest one. The overall age at death was 75 å± 13 yr. Only 1.6% of decedents were women; among women 25% were in the youngest age group, while among men only 4% were in the youngest group. Most decedents were enlisted personnel, and 60% served in the U.S. Army. Nearly 61% had a disability rating of >50% and for the middle age group 54% had a disability rating of 100%. The most common service-connected conditions were tinnitus, hearing loss, and post-traumatic stress disorder (PTSD). In the oldest group, nearly half of deaths were due to cancer or cardiovascular conditions and <2% were due to external causes. In the youngest group, cardiovascular disease and cancer accounted for about 1/3 of deaths, whereas external causes or deaths due to accidents, suicide, or assault accounted for nearly 33% of deaths. For Veterans with service-connected PTSD or major depression; 6.5% of deaths were due to external causes whereas for Veterans without these conditions, only 3.1% were due to external causes.|The finding of premature death due to external causes in the youngest age group as well as the finding of higher proportions of external causes in those with PTSD or major depression should be of great concern to those who care for Veterans.","%U https://www.ncbi.nlm.nih.gov/pubmed/29590473"
"X3995","%D 2014","%B Psychiatr Serv","%M 24292523","%A McKibben, J. B.","%T Suicidal behaviors and the use of mental health services among active duty Army soldiers","%X U.S. Army personnel experience a significant mental health burden, particularly during times of war and multiple deployments. This study identified rates of suicidality (seriously considering or attempting suicide) and types of mental health services used in the past 12 months by active duty Army soldiers.|This study used the 2008 Department of Defense Survey of Health Related Behaviors Among Active Duty Military Personnel, which sampled 10,400 Army soldiers from a total population of 508,088 soldiers. Mental health service utilization included receiving counseling or therapy from a general medical doctor, receiving counseling or therapy from a mental health professional, and being prescribed medications for depression, anxiety, or sleep. Suicidality was assessed via self-report questions.|Thirteen percent had seriously considered or attempted suicide at some point in their lives, 7% since joining the military. One percent who reported suicidality since joining the Army reported having considered or attempted suicide in the past year. After the analyses adjusted for sociodemographic factors, soldiers who seriously considered or attempted suicide since joining the military versus those who did not were 1.71 times more likely to have used a mental health service, 2.33 times more likely to have used two or more types of services, 1.82 times more likely to have seen a mental health specialist, and 1.67 times more likely to have received medication in the past year.|Understanding the relationship between suicidal thoughts and behaviors and the specific levels and types of mental health services received in this military population is important for health care provision and planning.","%U https://www.ncbi.nlm.nih.gov/pubmed/24292523"
"X4039","%D 2020","%B J Gen Intern Med","%M 31659663","%A Meerwijk, E. L.","%T Nonpharmacological Treatment of Army Service Members with Chronic Pain Is Associated with Fewer Adverse Outcomes After Transition to the Veterans Health Administration","%X Potential protective effects of nonpharmacological treatments (NPT) against long-term pain-related adverse outcomes have not been examined.|To compare active duty U.S. Army service members with chronic pain who did/did not receive NPT in the Military Health System (MHS) and describe the association between receiving NPT and adverse outcomes after transitioning to the Veterans Health Administration (VHA).|A longitudinal cohort study of active duty Army service members whose MHS healthcare records indicated presence of chronic pain after an index deployment to Iraq or Afghanistan in the years 2008-2014 (N = 142,539). Propensity score-weighted multivariable Cox proportional hazard models tested for differences in adverse outcomes between the NPT group and No-NPT group.|NPT received in the MHS included acupuncture/dry needling, biofeedback, chiropractic care, massage, exercise therapy, cold laser therapy, osteopathic spinal manipulation, transcutaneous electrical nerve stimulation and other electrical manipulation, ultrasonography, superficial heat treatment, traction, and lumbar supports.|Primary outcomes were propensity score-weighted proportional hazards for the following adverse outcomes: (a) diagnoses of alcohol and/or drug disorders; (b) poisoning with opioids, related narcotics, barbiturates, or sedatives; (c) suicide ideation; and (d) self-inflicted injuries including suicide attempts. Outcomes were determined based on ICD-9 and ICD-10 diagnoses recorded in VHA healthcare records from the start of utilization until fiscal year 2018.|The propensity score-weighted proportional hazards for the NPT group compared to the No-NPT group were 0.92 (95% CI 0.90-0.94, P < 0.001) for alcohol and/or drug use disorders; 0.65 (95% CI 0.51-0.83, P < 0.001) for accidental poisoning with opioids, related narcotics, barbiturates, or sedatives; 0.88 (95% CI 0.84-0.91, P < 0.001) for suicide ideation; and 0.83 (95% CI 0.77-0.90, P < 0.001) for self-inflicted injuries including suicide attempts.|NPT provided in the MHS to service members with chronic pain may reduce risk of long-term adverse outcomes.","%U https://www.ncbi.nlm.nih.gov/pubmed/31659663"
"X4198","%D 2023","%B Mil Psychol","%M 37262299","%A Moceri-Brooks, J.","%T The Purple Heart and suicide risk in Post-9/11 U.S. Army Combat Veterans with a traumatic brain injury: A mixed methods study","%X Active service members and Veterans with a combat-related traumatic brain injury (TBI) are four times more likely to attempt suicide than those without a TBI. TBIs are the signature injuries of the Post-9/11 conflicts and Combat Veterans (i.e., current and former service members who deployed in support of a combat mission) with these injuries are entitled to receive the Purple Heart medal. However, potentially tens of thousands of Combat Veterans did not receive, or were denied the Purple Heart during the first decade of the Global War on Terrorism because a TBI was not documented during the deployment. To our knowledge, this is the first study to explore the meaning of the Purple Heart and examine the impact of the Purple Heart on Army Combat Veterans with a combat-related TBI. Findings from this mixed methods study revealed that not receiving the Purple Heart is associated with increased suicide risk and lower quality of life after a brain injury. Additionally, thwarted belongingness, perceived burdensomeness, and perceived military institutional betrayal are associated with increased suicide risk in Army Combat Veterans with a TBI. This mixed methods study provides important insights into how Army culture is perceived and the power of the Purple Heart among this high-risk group of Combat Veterans.","%U https://www.ncbi.nlm.nih.gov/pubmed/37262299"
"X4233","%D 1989","%B Am J Epidemiol","%M 2683747","%A Moyer, L. A.","%T Validity of death certificates for injury-related causes of death","%X Exploration of the validity of death certificate information for classifying underlying causes of death has historically focused on ""natural"" or disease-related causes of death. Current interest in injury-related deaths has emphasized the need for proper certification and coding of these deaths. In this study, the authors compared agreement of the underlying cause of death as determined from death certificate information with that determined from an independent review of all relevant medical and legal documents of death by a panel of physicians. The study sample included all deaths (n = 446) occurring over an approximately 18-year follow-up period (1965-1983) in a randomly selected cohort of 18,313 US Army Veterans of the Vietnam era. Using the physician panel as the ""gold standard,"" sensitivity and specificity were 90% or greater for broad groupings of motor vehicle crash deaths (International Classification of Diseases, Ninth Revision (ICD-9), codes E810-E825), suicides (codes E950-E959), and homicides (codes E960-E969). Agreement for deaths from unintentional poisonings (codes E850-E869), mostly drug- and alcohol-related, was poor (sensitivity, 50 percent); in general, the ICD-9 drug- and alcohol-specific nomenclature is difficult to apply. The specificity and sensitivity for the individual three-digit suicide and homicide codes were all greater than 90%, and although the specificity for three-digit motor vehicle crash deaths was also above 90%, the sensitivity was lower, from 29% to 83%. Agreement on the fourth digit of ICD-9--for example, the role of the decedent in a motor vehicle crash death--was generally poor. The lack of descriptive information on death certificates to allow detailed coding was chiefly responsible for the poor agreement.","%U https://www.ncbi.nlm.nih.gov/pubmed/2683747"
"X4268","%D 2019","%B Mol Psychiatry","%M 30104726","%A Naifeh, J. A.","%T The Army Study to Assess Risk and Resilience in Servicemembers (Army STARRS): progress toward understanding suicide among soldiers","%X Responding to an unprecedented increase in the suicide rate among soldiers, in 2008 the US Army and US National Institute of Mental Health funded the Army Study to Assess Risk and Resilience in Servicemembers (Army STARRS), a multicomponent epidemiological and neurobiological study of risk and resilience factors for suicidal thoughts and behaviors, and their psychopathological correlates among Army personnel. Using a combination of administrative records, representative surveys, computerized neurocognitive tests, and blood samples, Army STARRS and its longitudinal follow-up study (STARRS-LS) are designed to identify potentially actionable findings to inform the Army's suicide prevention efforts. The current report presents a broad overview of Army STARRS and its findings to date on suicide deaths, attempts, and ideation, as well as other important outcomes that may increase suicide risk (e.g., mental disorders, sexual assault victimization). The findings highlight the complexity of environmental and genetic risk and protective factors in different settings and contexts, and the importance of life and career history in understanding suicidal thoughts and behaviors.","%U https://www.ncbi.nlm.nih.gov/pubmed/30104726"
"X4316","%D 2021","%B Med Care","%M 33438882","%A Naifeh, J. A.","%T Sex Differences in US Army Suicide Attempts During the Wars in Iraq and Afghanistan","%X To examine sex differences in risk for administratively documented suicide attempt (SA) among US Army soldiers during the Iraq/Afghanistan wars.|Using administrative person-month records of Regular Army enlisted soldiers from 2004 to 2009, we identified 9650 person-months with a first documented SA and an equal-probability control sample (n=153,528 person-months). Person-months were weighted to the population and pooled over time. After examining the association of sex with SA in a logistic regression analysis, predictors were examined separately among women and men.|Women (an estimated 13.7% of the population) accounted for 25.2% of SAs and were more likely than men to attempt suicide after adjusting for sociodemographic, service-related, and mental health diagnosis (MHDx) variables (odds ratio=1.6; 95% confidence interval, 1.5-1.7). Women with increased odds of SA in a given person-month were younger, non-Hispanic White, less educated, in their first term of enlistment, never or previously deployed (vs. currently deployed), and previously received a MHDx. The same variables predicted SA among men. Interactions indicated significant but generally small differences between women and men on 6 of the 8 predictors, the most pronounced being time in service, deployment status, and MHDx. Discrete-time survival models examining risk by time in service demonstrated that patterns for women and men were similar, and that women's initially higher risk diminished as time in service increased.|Predictors of documented SAs are similar for US Army women and men. Differences associated with time in service, deployment status, and MHDx require additional research. Future research should consider stressors that disproportionately affect women.","%U https://www.ncbi.nlm.nih.gov/pubmed/33438882"
"X4375","%D 2022","%B Suicide Life Threat Behav","%M 34866228","%A Naifeh, J. A.","%T Association of emotion reactivity and distress intolerance with suicide attempts in U.S. Army soldiers","%X Emotion reactivity (ER) and distress intolerance (DI) may be associated with increased suicide attempt (SA) risk among U.S. Army soldiers.|In this case-control study, 74åÊsoldiers recently hospitalized for SA (cases) were compared with 133 control soldiers from the same Army installations selected based on either propensity score matching (n = 103) or reported 12-month suicide ideation (SI) (n = 30). Controls were weighted to represent the total Army population at the study sites and the subpopulation of 12-month ideators. Participants completed questionnaires assessing ER, DI, and other psychosocial variables. Logistic regression analyses examined whether ER and DI differentiated SA cases from the general population and from 12-month ideators before and after controlling for additional important risk factors (sociodemographic characteristics, stressors, mental disorders).|In univariate analyses, ER differentiated SA cases from both the general population (OR = 2.5[95%CI = 1.7-3.6]) and soldiers with 12-month SI (OR = 2.5[95%CI = 1.3-4.6]). DI also differentiated cases from the general population (OR = 2.9[95%CI = 2.0-4.1]) and 12-month ideators (OR = 1.9[95%CI = 1.1-3.5]). These associations persisted after controlling for sociodemographic variables, stressors, and mental disorders.|Findings provide evidence that higher ER and DI are associated with increased risk of SA among soldiers, even after adjusting for known risk factors. Prospective research with larger samples is needed.","%U https://www.ncbi.nlm.nih.gov/pubmed/34866228"
"X4493","%D 2020","%B Depress Anxiety","%M 32291817","%A Naifeh, J. A.","%T Self-injurious thoughts and behaviors that differentiate soldiers who attempt suicide from those with recent suicide ideation","%X Risk for suicide attempt (SA) versus suicide ideation (SI) is clinically important and difficult to differentiate. We examined whether a history of self-injurious thoughts and behaviors (SITBs) differentiates soldiers with a recent SA from nonattempting soldiers with current/recent SI.|Using a unique case-control design, we administered the same questionnaire (assessing the history of SITBs and psychosocial variables) to representative U.S. Army soldiers recently hospitalized for SA (n‰Ûä=‰Ûä132) and soldiers from the same Army installations who reported 30-day SI but did not make an attempt (n‰Ûä=‰Ûä125). Logistic regression analyses examined whether SITBs differentiated attempters and ideators after controlling for previously identified covariates.|In separate models that weighted for systematic nonresponse and controlled for gender, education, posttraumatic stress disorder, and intermittent explosive disorder, SA was positively and significantly associated with the history of suicide plan and/or intention to act (odds ratio [OR]‰Ûä=‰Ûä12.1 [95% confidence interval {CI}‰Ûä=‰Ûä3.6-40.4]), difficulty controlling suicidal thoughts during the worst week of ideation (OR‰Ûä=‰Ûä3.5 [95% CI‰Ûä=‰Ûä1.1-11.3]), and nonsuicidal self-injury (NSSI) (OR‰Ûä=‰Ûä4.9 [95% CI‰Ûä=‰Ûä1.3-18.0]). Area under the curve was 0.87 in a full model that combined these SITBs and covariates. The top ventile based on predicted risk had a sensitivity of 24.7%, specificity of 99.8%, and positive predictive value of 97.5%.|History of suicide plan/intention, difficult to control ideation, and NSSI differentiate soldiers with recent SA from those with current/recent SI independent of sociodemographic characteristics and mental disorders. Longitudinal research is needed to determine whether these factors are prospectively associated with the short-term transition from SI to SA.","%U https://www.ncbi.nlm.nih.gov/pubmed/32291817"
"X4556","%D 2017","%B Suicide Life Threat Behav","%M 27801502","%A Naifeh, J. A.","%T Neurocognitive Function and Suicide in U.S. Army Soldiers","%X This prospective cohort study used administrative data from the Army Study to Assess Risk and Resilience in Servicemembers to examine associations between neurocognitive functioning and subsequent suicidal events among Regular Army enlisted soldiers during the years 2004-2009. Cases were all soldiers who completed the Army's Automated Neuropsychological Assessment Metrics (ANAM) computerized testing battery prior to documented suicide attempt (nåÊ=åÊ607), ideation (nåÊ=åÊ955), or death (nåÊ=åÊ57). Controls were an equal-probability sample of 9,893 person-months from other soldiers. Exploratory factor analysis of five ANAM tests identified a general neurocognitive factor that excluded the mathematic processing test (MTH). When examined separately in logistic regression analyses that controlled for sociodemographics and prior mental health diagnosis, both the general neurocognitive factor (logit [ë_]åÊ=åÊ-.197 to -.521; påÊ<åÊ.01) and MTH (ë_åÊ=åÊ-.024 to -.064; påÊ<åÊ.05) were associated with all outcomes. When both predictors were examined simultaneously, the general neurocognitive factor continued to be associated with all outcomes (ë_åÊ=åÊ-.164 to -.417; påÊ<åÊ.05) and MTH continued to be associated with suicide attempt (ë_åÊ=åÊ-.015; påÊ=åÊ.046) and ideation (ë_åÊ=åÊ-.014; påÊ=åÊ.018). These small but robust associations suggest that future research must continue to examine the extent to which objective neurocognitive tests may enhance understanding and prediction of suicide risk.","%U https://www.ncbi.nlm.nih.gov/pubmed/27801502"
"X4612","%D 2020","%B Suicide Life Threat Behav","%M 31544970","%A Naifeh, J. A.","%T Early First Deployment and Risk of Suicide Attempt Among First-term Enlisted Soldiers in the U.S. Army","%X We examined early first deployment and subsequent suicide attempt among U.S. Army soldiers.|Using 2004-2009 administrative data and person-month records of first-term, Regular Army, enlisted soldiers with one deployment (89.2% male), we identified 1,704 soldiers with a documented suicide attempt during or after first deployment and an equal-probability control sample (nåÊ=åÊ25,861 person-months).|Logistic regression analyses indicated soldiers deployed within the first 12åÊmonths of service were more likely than later deployers to attempt suicide (ORåÊ=åÊ1.7 [95% CIåÊ=åÊ1.5-1.8]). Adjusting for sociodemographic characteristics, service-related characteristics, and previous mental health diagnosis slightly attenuated this association (ORåÊ=åÊ1.6 [95% CIåÊ=åÊ1.5-1.8]). Results were not modified by gender, deployment status, military occupation, or mental health diagnosis. The population-attributable risk proportion for deploying within the first 12åÊmonths of service was 17.8%. Linear spline models indicated similar risk patterns over time for early and later deployers, peaking at month 9 during deployment and month 5 postdeployment; however, monthly suicide attempt rates were consistently higher for early deployers.|Enlisted soldiers deployed within the first 12åÊmonths of service have elevated risk of suicide attempt during and after first deployment. Improved understanding of why early deployment increases risk can inform the development of policies and intervention programs.","%U https://www.ncbi.nlm.nih.gov/pubmed/31544970"
"X4668","%D 2019","%B BMC Psychiatry","%M 30658601","%A Naifeh, J. A.","%T Suicide attempts among activated soldiers in the U.S. Army reserve components","%X Although the majority of active duty U.S. Army soldiers are full-time personnel in the Active Component (AC), a substantial minority of soldiers on active duty are in the Reserve Components (RCs). These ""citizen-soldiers"" (Army National Guard and Army Reserve) represent a force available for rapid activation in times of national need. RC soldiers experience many of the same stressors as AC soldiers as well as stressors that are unique to their intermittent service. Despite the important role of RC soldiers, the vast majority of military mental health research focuses on AC soldiers. One important goal of the Army Study to Assess Risk and Resilience in Servicemembers (Army STARRS) is to address this gap. Here we examine predictors of suicide attempts among activated RC soldiers.|This longitudinal, retrospective cohort study used individual-level person-month records from Army and Department of Defense administrative data systems to examine socio-demographic, service-related, and mental health predictors of medically documented suicide attempts among activated RC soldiers during 2004-2009. Data from all 1103 activated RC suicide attempters and an equal-probability sample of 69,867 control person-months were analyzed using a discrete-time survival framework.|Enlisted soldiers comprised 84.3% of activated RC soldiers and accounted for 95.7% of all activated RC suicide attempts (overall rate‰Ûä=‰Ûä108/100,000 person-years, more than four times the rate among officers). Multivariable predictors of enlisted RC suicide attempts included being female, entering Army service at age‰Ûä‰ä´‰Ûä25, current age‰Ûä<‰Ûä30, non-Hispanic white, less than high school education, currently married, having 1-2‰Ûäyears of service, being previously deployed (vs. currently deployed), and history of mental health diagnosis (particularly when documented in the previous month). Predictors among RC officers (overall rate‰Ûä=‰Ûä26/100,000 person-years) included being female and receiving a mental health diagnosis in the previous month. Discrete-time hazard models showed suicide attempt risk among enlisted soldiers was inversely associated with time in service.|Risk factors for suicide attempt in the RCs were similar to those previously observed in the AC, highlighting the importance of research and prevention focused on RC enlisted soldiers in the early phases of Army service and those with a recent mental health diagnosis.","%U https://www.ncbi.nlm.nih.gov/pubmed/30658601"
