"new.article.id","year","journal","pmid","author","title","abstract","url"
"X1639","%D 2012","%B Telemed J E Health","%M 23061646","%A Doarn, C. R.","%T Challenges, solutions, and best practices in telemental health service delivery across the pacific rim-a summary","%X The Telemedicine and Advanced Technology Research Center, U.S. Army Medical Research and Materiel Command, in conjunction with the American Telemedicine Association's Annual Mid-Year Meeting, conducted a 1-day workshop on how maturing and emerging processes and applications in the field of telemental health (TMH) can be expanded to enhance access to behavioral health services in the Pacific Rim. The purpose of the workshop was to bring together experts in the field of TMH from the military, federal agencies, academia, and regional healthcare organizations serving populations in the Pacific Rim. The workshop reviewed current technologies and systems to better understand their current and potential applications to regional challenges, including the Department of Defense and other federal organizations. The meeting was attended by approximately 100 participants, representing military, government, academia, healthcare centers, and tribal organizations. It was organized into four sessions focusing on the following topic areas: (1) Remote Screening and Assessment; (2) Post-Deployment Adjustment Mental Health Treatment; (3) Suicide Prevention and Management; and (4) Delivery of Training, Education, and Mental Health Work Force Development. The meeting's goal was to discuss challenges, gaps, and collaborative opportunities in this area to enhance existing or create new opportunities for collaborations in the delivery of TMH services to the populations of the Pacific Rim. A set of recommendations for collaboration are presented.","%U https://www.ncbi.nlm.nih.gov/pubmed/23061646"
"X1679","%D 2018","%B Health Educ Behav","%M 29353545","%A Elliman, T. D.","%T Prevalence of Bystander Intervention Opportunities and Behaviors Among U.S. Army Soldiers","%X The bystander intervention model is one approach utilized to reduce risky behaviors within the U.S. Army; however, it is unclear how frequently soldiers experience opportunities to intervene and whether they already intervene in such situations. The present analysis aims to ascertain frequencies for opportunities to intervene and the rates at which soldiers intervene when presented with such opportunities. Soldiers ( N = 286) were asked whether they had witnessed particular risky behavior scenarios of interest to the Army (i.e., suicide-related behaviors, alcohol misuse, or sexual harassment/assault) during the previous 2 months and whether they had intervened in those scenarios. Prevalence rates within this sample were calculated to determine the frequency of such situations and subsequent interventions. Logistic regression was used to ascertain any differences in witnessing scenarios by demographic groups. Nearly half (46.8%) of the soldiers reported witnessing at least one scenario involving risky behaviors. Most soldiers who witnessed an event relating to suicide or alcohol misuse also reported consistently intervening (87.9% and 74.4%, respectively), whereas just half consistently intervened in response to scenarios relating to sexual harassment/assault (49.2%). Lower ranking soldiers were twice as likely as higher ranks to witness scenarios involving alcohol misuse (odds ratio = 2.18, 95% confidence interval [1.11, 4.26]) and sexual harassment/assault (odds ratio = 2.21, 95% confidence interval [1.05, 4.62]). These data indicate that soldiers regularly encounter opportunities to intervene in risky behaviors, and while a majority intervened in such scenarios, more training is warranted, particularly around sexual assault and harassment. This supports the notion that bystander intervention training is a worthwhile investment for the Army.","%U https://www.ncbi.nlm.nih.gov/pubmed/29353545"
"X1726","%D 2012","%B Mil Med","%M 23025127","%A Gadermann, A. M.","%T Projected rates of psychological disorders and suicidality among soldiers based on simulations of matched general population data","%X Limited data are available on lifetime prevalence and age-of-onset distributions of psychological disorders and suicidal behaviors among Army personnel. We used simulation methods to approximate such estimates based on analysis of data from a U.S. national general population survey with the sociodemographic profile of U.S. Army personnel. Estimated lifetime prevalence of any Diagnostic and Statistical Manual of Mental Disorders, Fourth Edition (DSM-IV) anxiety, mood, behavior, or substance disorder in this sample was 53.1% (17.7% for mood disorders, 27.2% for anxiety disorders, 22.7% for behavior disorders, and 14.4% for substance disorders). The vast majority of cases had onsets before the expected age of enlistment if they were in the Army (91.6%). Lifetime prevalence was 14.2% for suicidal ideation, 5.4% for suicide plans, and 4.5% for suicide attempts. The proportion of estimated preenlistment onsets was between 68.4% (suicide plans) and 82.4% (suicidal ideation). Externalizing disorders with onsets before expected age of enlistment and internalizing disorders with onsets after expected age of enlistment significantly predicted postenlistment suicide attempts, with population attributable risk proportions of 41.8% and 38.8%, respectively. Implications of these findings are discussed for interventions designed to screen, detect, and treat psychological disorders and suicidality in the Army.","%U https://www.ncbi.nlm.nih.gov/pubmed/23025127"
"X1773","%D 2015","%B Work","%M 25227672","%A Gallaway, M. S.","%T A mixed methods epidemiological investigation of preventable deaths among U.S. Army soldiers assigned to a rehabilitative warrior transition unit","%X The prevalence of medical risk factors for suicide (e.g., mental disorders, severe disability, social disruption) may be higher among WTs compared to traditional Army units. Likewise, the extent to which traditional factors that protect soldiers from developing serious mental disorders (e.g., social support, unit cohesion, leadership) are present among soldiers assigned to the WTU is unclear.|An epidemiological consultation (EPICON) was conducted in 2010 to assess potential causes for a perceived high rate of suicides and preventable deaths in U.S. Army Warrior Transition Units (WTUs) and to identify potential improvements to the system of care.|The EPICON focused on: (1) risk factors for suicide/preventable deaths; (2) chronic pain management; (3) utilization of and access to WTU medical and behavioral health (BH) services; and (4) the impact of the WTU environment on mission focus and warrior disposition. BH history was examined for soldiers who died by suicide or preventable death while assigned to the WTU (index cases) and a representative comparison group of non-index case soldiers. Surveys and focus groups were conducted at four WTUs with Warriors in Transition (WTs) and key support staff.|The use of psychotropic and/or CNS depressant medications, prevalence of BH diagnoses and substance use disorders, polypharmacy, alcohol use, and a high cumulative number of stressors were identified as important risk factors for preventable deaths in the WTC. Areas of potential improvement to the system of care included addressing negative perceptions of the WTU environment, lack of social support, barriers to accessing BH services and issues related to coordination of care.|There was no one single risk factor found to be associated with an increased likelihood of preventable deaths within the WTU. The unique design and operation of the WTUs as environments focused on treatment and rehabilitation provide both benefits and challenges to recovery and risk mitigation.","%U https://www.ncbi.nlm.nih.gov/pubmed/25227672"
"X1907","%D 2014","%B Psychol Med","%M 25055175","%A Gilman, S. E.","%T Sociodemographic and career history predictors of suicide mortality in the United States Army 2004-2009","%X The US Army suicide rate has increased sharply in recent years. Identifying significant predictors of Army suicides in Army and Department of Defense (DoD) administrative records might help focus prevention efforts and guide intervention content. Previous studies of administrative data, although documenting significant predictors, were based on limited samples and models. A career history perspective is used here to develop more textured models.|The analysis was carried out as part of the Historical Administrative Data Study (HADS) of the Army Study to Assess Risk and Resilience in Servicemembers (Army STARRS). De-identified data were combined across numerous Army and DoD administrative data systems for all Regular Army soldiers on active duty in 2004-2009. Multivariate associations of sociodemographics and Army career variables with suicide were examined in subgroups defined by time in service, rank and deployment history.|Several novel results were found that could have intervention implications. The most notable of these were significantly elevated suicide rates (69.6-80.0 suicides per 100åÊ000 person-years compared with 18.5 suicides per 100åÊ000 person-years in the total Army) among enlisted soldiers deployed either during their first year of service or with less than expected (based on time in service) junior enlisted rank; a substantially greater rise in suicide among women than men during deployment; and a protective effect of marriage against suicide only during deployment.|A career history approach produces several actionable insights missed in less textured analyses of administrative data predictors. Expansion of analyses to a richer set of predictors might help refine understanding of intervention implications.","%U https://www.ncbi.nlm.nih.gov/pubmed/25055175"
"X1977","%D 2019","%B Psychol Serv","%M 30359074","%A Goodin, C. A.","%T Financial hardship and risk of suicide among U.S. Army personnel","%X Financial stress has been frequently identified as a risk factor for suicidal behavior, both in military and civilian groups. However, it remains unclear to what degree financial stress may be associated independently with suicide behavior when accounting for other risk factors. This study examined data on suicide and suicide attempt cases in the Department of Defense Suicide Event Report compared with service members who did not have recent suicide behavior. The resulting multinomial regression analysis found that financial distress had a weak association with suicide, and its relationship to suicide attempts was not statistically significant. Compared with financial distress, relationship problems and substance abuse history appeared to have much stronger associations with suicidal behavior, as did having a diagnosis of a mood disorder, such as major depressive disorder. The major conclusion from these data are that although financial distress may be a risk factor for suicidal behavior, the relationship is likely indirect and considerably less substantial than previously suspected. In addition, its relative influence is significantly less than other identified risk factors. (PsycINFO Database Record (c) 2019 APA, all rights reserved).","%U https://www.ncbi.nlm.nih.gov/pubmed/30359074"
"X2023","%D 2019","%B Behav Res Ther","%M 31248578","%A Hamedi, A.","%T Attentional bias and the Suicide Status Form: Behavioral perseveration of written responses","%X Given the vast public health problem of suicide, the need for more effective assessment of suicidal risk is clear. The major approaches applied to this challenge include various direct approaches (e.g., suicide-focused interviews) and indirect approaches (e.g., implicit methodologies or ""occult"" assessments) that tend to assess an attentional bias for suicidal risk, the latter of which the present investigation sought to study. Using the Suicide Status Form (SSF)-the central multi-purpose tool that is used within a collaborative assessment process with suicidal patients who are engaged in the ""Collaborative Assessment and Management of Suicidality"" (CAMS; Jobes, 2016)-we aimed to investigate the influence of perseverative, hand-written content responses pertaining to potential suicidal risk. Specifically, we explored whether repeating certain topic content might reflect a perseverative response style; we thus compared written content results of first session SSFs taken from a sample of suicidal U.S. Army Soldiers (Study 1) and a sample of suicidal college students (Study 2). Across the two studies, patients who repeated the same content (""1-Topic Repeaters"") had significantly higher ratings related to suicidal ideation in comparison to those with more heterogeneous response styles. This replicated finding perhaps reveals a form of behavioral perseveration that is potentially related to increased suicidal risk with possible implications for successful treatment.","%U https://www.ncbi.nlm.nih.gov/pubmed/31248578"
"X2069","%D 2016","%B Mil Med","%M 27483518","%A Herberman Mash, H. B.","%T Alcohol Use and Reasons for Drinking as Risk Factors for Suicidal Behavior in the U.S. Army","%X High levels of alcohol use and alcohol-related problems are associated with suicidal behaviors (i.e., seriously considering and/or attempting suicide) in military and civilian populations. Examination of reasons for drinking alcohol may identify subgroups of soldiers who may either be at risk for suicidal behaviors or resilient to suicidality.|We examined the associations among reasons for drinking, level of alcohol use, and past year suicidality in 3,813 U.S. Army soldiers using the Department of Defense Survey of Health-Related Behaviors among Active Duty Military Personnel.|Six percent of soldiers reported suicidal thoughts and behaviors within the past year. Those who reported the highest level of alcohol use were more likely to have seriously considered and/or attempted suicide. Drinking to avoid rejection/""fit in"" was associated with suicidality, even after adjusting for level of alcohol consumption, post-traumatic stress disorder, and depression. Although unadjusted analyses revealed a relation of pleasure-seeking drinking motives to suicidality, this association did not remain significant after controlling for covariates.|Drinking to avoid rejection/""fit in"" is associated with suicidality above overall alcohol consumption. Screening for this reason for drinking may be useful for suicide prediction and prevention.","%U https://www.ncbi.nlm.nih.gov/pubmed/27483518"
"X2159","%D 2022","%B J Psychiatr Res","%M 33190841","%A Hoffman, S. N.","%T Association between neurocognitive functioning and suicide attempts in U.S. Army Soldiers","%X Suicide is a serious public health problem, including among U.S. Army personnel. There is great interest in discovering objective predictors of suicide and non-fatal suicidal behaviors. The current study examined the association between neurocognitive functioning and pre-military history of suicide attempts (SA) and post-enlistment onset of SA.|New Soldiers reporting for Basic Combat Training (NåÊ=åÊ38,507) completed a comprehensive computerized neurocognitive assessment battery and self-report questionnaires. A subset of Soldiers (nåÊ=åÊ6216) completed a follow-up survey, including assessment of lifetime SA, 3-7 years later.|Six hundred eighty-nine Soldiers indicated lifetime SA at baseline and 210 Soldiers indicated new-onset SA at follow-up. Regression analyses, adjusted for demographic variables, revealed significant bivariate associations between neurocognitive performance on measures of sustained attention, impulsivity, working memory, and emotion recognition and lifetime SA at baseline. In a multivariable model including each of these measures as predictors, poorer impulse control and quicker response times on an emotion recognition measure were significantly and independently associated with increased odds of lifetime SA. A second model predicted new-onset SA at follow-up for Soldiers who did not indicate a history of SA at baseline. Poorer impulse control on a measure of sustained attention was predictive of new-onset SA.|Effect sizes are small and of unlikely clinical predictive utility.|We simultaneously examined multiple neurocognitive domains as predictors of SA in a large, representative sample of new Army Soldiers. Impulsivity most strongly predicted past and future SA over and beyond other implicated cognitive-emotional domains.","%U https://www.ncbi.nlm.nih.gov/pubmed/33190841"
"X2265","%D 2018","%B Mil Med","%M 29547934","%A Hoopsick, R. A.","%T Developing a Measure to Assess Emotions Associated with Never Being Deployed","%X Much research has focused on stress related to deployments; however, a substantial proportion of soldiers never deploy. In a study of 1.3 million veterans, suicide risk was higher among veterans who had never deployed. Thus, not being deployed may have an impact on soldiers' well-being; however, no measures exist to assess emotions regarding non-deployment. We aimed to develop and test an original measure of non-deployment emotions.|We examined the Non-Deployment Emotions (NDE) questionnaire, a novel four-item measure of guilt, unit value, unit camaraderie, and unit connectedness in a sample of never-deployed male and female US Army Reserve/National Guard (USAR/NG) soldiers (N = 174). Data are from Operation: SAFETY (Soldiers and Families Excelling Through the Years), an ongoing survey-based study examining the health of USAR/NG soldiers and their partners. The protocol was approved by the Institutional Review Board at the State University of New York at Buffalo. The relationship between each of the items was examined by calculating correlation and alpha coefficients. Latent class analyses tested for the existence of distinct levels of negative emotions related to non-deployment. Negative binomial regression models examined the cross-sectional associations between NDE summary score and each of the following outcomes, separately: anger, anxiety, depression, and post-traumatic stress.|More than half of never-deployed USAR/NG soldiers expressed negative emotions for having not been deployed. ""Guilt,"" ""value,"" ""camaraderie,"" and ""connectedness"" were each positively correlated with each other (p < 0.001) and the internal consistency reliability was high (male soldier ë± = 0.90, female soldier ë± = 0.93). Latent class analyses revealed a superior three-class model with well-delineated class membership (entropy = 0.93): ""Class 1"" (low NDE; 47.6%), ""Class 2"" (moderate NDE; 33.8%), and ""Class 3"" (high NDE; 18.6%). Regression models demonstrated that greater non-deployment emotions were independently associated with more severe anger (RR = 1.02, 95% CI: 1.01, 1.03, p < 0.001), anxiety (RR = 1.06, 95% CI: 1.01, 1.11, p < 0.05), depression (RR = 1.06, 95% CI: 1.01, 1.11, p < 0.05), and PTSD (RR = 1.10, 95% CI: 1.04, 1.16, p < 0.01).|Findings demonstrate that negative emotions regarding non-deployment are prevalent among never-deployed USAR/NG soldiers and that these emotions are related to a mental health. The NDE provides a measure of ""guilt,"" ""value,"" ""camaraderie,"" and ""connectedness"" specific to non-deployed soldiers and is able to well discriminate between soldiers that have low, moderately, and highly negative non-deployment emotions. These findings suggest that all military personnel, regardless of deployment status, could be at risk for negative outcomes. As with any survey-based study, there is a potential for response bias; however, given the range of responses collected with the NDE, social desirability is unlikely. Further work is needed to confirm our findings in other components of the military and to examine soldiers in the rear detachment.","%U https://www.ncbi.nlm.nih.gov/pubmed/29547934"
"X2345","%D 2019","%B Mil Med","%M 30901390","%A Hoyt, T.","%T Development and Implementation of U.S. Army Guidelines for Managing Soldiers at Risk of Suicide","%X Despite significant efforts in suicide prevention over the past several years, suicide rates in the U.S. Army remain largely unchanged. This paper describes a collaborative effort between line-unit leaders, medical personnel, and installation services to synchronize suicide risk identification and communication between these disparate entities.|Under the direction of the Installation Director of Psychological Health at Joint Base Lewis-McChord, a Behavioral Health Process Action Team was chartered to identify best practice and formulate policy for identifying and managing service members at risk for suicide.|Compliance with the new policy reached 100% within 6 months of implementation, as measured by peer review of records. This installation policy was subsequently identified as a best practice and adopted Army-wide as the standard of practice.|Knowledge transfer of research findings into policy and practice is crucial for suicide prevention. The current policy shows good integration of current research with practice in military settings.|Combined efforts in crafting policy for risk identification and communication resulted in a policy that was acceptable and feasible from the perspective of commanders and clinicians. Synchronization efforts between commanders, clinicians, and support services are crucial to ensure effective intervention to prevent suicide behavior.","%U https://www.ncbi.nlm.nih.gov/pubmed/30901390"
"X2377","%D 2017","%B Psychiatry","%M 29466107","%A Jobes, D. A.","%T A Randomized Controlled Trial of the Collaborative Assessment and Management of Suicidality versus Enhanced Care as Usual With Suicidal Soldiers","%X This study describes a randomized controlled trial called ""Operation Worth Living"" (OWL) which compared the use of the Collaborative Assessment and Management of Suicidality (CAMS) to enhanced care as usual (E-CAU). We hypothesized that CAMS would be more effective than E-CAU for reducing suicidal ideation (SI) and suicide attempts (SA), along with secondary behavioral health and health care utilization markers for U.S. Army Soldier outpatients with significant SI (i.e., > 13 on Beck's Scale for Suicide Ideation).|Study participants were 148 Soldiers who presented to a military outpatient behavioral health clinic. There were 73 Soldiers in the experimental arm of the trial who received adherent CAMS; 75 Soldiers received E-CAU. Nine a-priori treatment outcomes (SI, past year SA, suicide-related emergency department (ED) admits, behavioral health-related ED admits, suicide-related inpatient psychiatric unit (IPU) days, behavioral health-related IPU days, mental health, psychiatric distress, resiliency) were measured through assessments at Baseline and at 1, 3, 6, and 12 months post-Baseline (with a 78% retention of intent-to-treat participants at 12 months).|Soldiers in both arms of the trial responded to study treatments in terms of all primary and secondary outcomes (effect sizes ranged from 0.63 to 12.04). CAMS participants were significantly less likely to have any suicidal thoughts by 3 months in comparison to those in E-CAU (Cohen's d = 0.93, p=.028).|Soldiers receiving CAMS and E-CAU significantly improved post-treatment. Those who received CAMS were less likely to report SI at 3 months; further group differences were not otherwise seen.","%U https://www.ncbi.nlm.nih.gov/pubmed/29466107"
"X2437","%D 2013","%B Int J Methods Psychiatr Res","%M 24318217","%A Kessler, R. C.","%T Design of the Army Study to Assess Risk and Resilience in Servicemembers (Army STARRS)","%X The Army Study to Assess Risk and Resilience in Servicemembers (Army STARRS) is a multi-component epidemiological and neurobiological study designed to generate actionable evidence-based recommendations to reduce US Army suicides and increase basic knowledge about the determinants of suicidality. This report presents an overview of the designs of the six components of the Army STARRS. These include: an integrated analysis of the Historical Administrative Data Study (HADS) designed to provide data on significant administrative predictors of suicides among the more than 1.6 million soldiers on active duty in 2004-2009; retrospective case-control studies of suicide attempts and fatalities; separate large-scale cross-sectional studies of new soldiers (i.e. those just beginning Basic Combat Training [BCT], who completed self-administered questionnaires [SAQs] and neurocognitive tests and provided blood samples) and soldiers exclusive of those in BCT (who completed SAQs); a pre-post deployment study of soldiers in three Brigade Combat Teams about to deploy to Afghanistan (who completed SAQs and provided blood samples) followed multiple times after returning from deployment; and a platform for following up Army STARRS participants who have returned to civilian life. Department of Defense/Army administrative data records are linked with SAQ data to examine prospective associations between self-reports and subsequent suicidality. The presentation closes with a discussion of the methodological advantages of cross-component coordination.","%U https://www.ncbi.nlm.nih.gov/pubmed/24318217"
